{
  "$schema": "https://json-schema.org/draft/2020-12/schema",
  "$id": "https://litigation-platform.local/case-box-contract/case-box-document.schema.json",
  "title": "CaseBoxDocument",
  "description": "Legal document registered to a matter. May reference an OCR job by value (never by FK).",
  "type": "object",
  "required": [
    "id",
    "tenant_id",
    "actor_user_id",
    "matter_id",
    "source",
    "filename",
    "content_hash",
    "storage_uri",
    "doc_type",
    "received_at",
    "status"
  ],
  "properties": {
    "id":            { "$ref": "#/$defs/ulid" },
    "tenant_id":     { "type": "string", "minLength": 1 },
    "actor_user_id": { "type": "string", "minLength": 1 },
    "matter_id":     { "$ref": "#/$defs/ulid" },
    "source": {
      "enum": ["uploaded", "produced", "subpoena", "court_filing", "third_party"]
    },
    "custody_chain": {
      "type": "array",
      "items": {
        "type": "object",
        "required": ["actor_user_id", "at"],
        "properties": {
          "actor_user_id": { "type": "string", "minLength": 1 },
          "action":        { "type": "string" },
          "at":            { "type": "string", "format": "date-time" },
          "notes":         { "type": "string" }
        }
      },
      "description": "Append-only chain of custody entries."
    },
    "filename":     { "type": "string", "minLength": 1 },
    "content_hash": {
      "type": "string",
      "minLength": 1,
      "description": "Immutable once OCR submitted. Persistence layer enforces immutability."
    },
    "storage_uri":  { "type": "string", "minLength": 1, "description": "Local filesystem path or opaque URI." },
    "ocr_job_id":   {
      "anyOf": [
        { "type": "null" },
        { "$ref": "#/$defs/ulid" }
      ],
      "description": "External-Ref to ocr-persistence by value; case-box never FKs to OCR tables."
    },
    "submission_hash": {
      "type": "string",
      "description": "Canonical OCR submission JSON hash; matches OCR dedupe key."
    },
    "language":   { "type": "string" },
    "page_count": { "type": "integer", "minimum": 1 },
    "doc_type": {
      "enum": ["pleading", "contract", "correspondence", "transcript", "exhibit", "other"]
    },
    "received_at": {
      "type": "string",
      "format": "date-time"
    },
    "status": {
      "enum": ["registered", "ocr_pending", "ocr_complete", "ocr_failed", "triaged", "tagged", "reviewed"]
    },
    "purpose": {
      "enum": [
        "engagement_contract",
        "payment_record",
        "decision_record",
        "court_procedural",
        "counsel_contract",
        "work_order",
        "lawyer_letter",
        "contract_review_input",
        "contract_review_final",
        "screenshot",
        "other"
      ],
      "description": "Workflow-role classification. Orthogonal to doc_type. Absent = 'other' by convention. R-5(a)."
    },
    "work_order_status": {
      "enum": ["open", "in_progress", "answered", "closed"],
      "description": "Lifecycle of a work-order document. One-way invariant: if present, purpose MUST be 'work_order'. NOT required when purpose='work_order'. R-5(b)."
    },
    "supersedes_document_id": {
      "anyOf": [
        { "type": "null" },
        { "$ref": "#/$defs/ulid" }
      ],
      "description": "Optional reference to a prior document this one supersedes (e.g. contract_review_final supersedes contract_review_input). Persistence enforces same-matter same-tenant. R-5(d)."
    },
    "letter_date": {
      "type": "string",
      "maxLength": 2000,
      "description": "Free-text date descriptor for purpose='lawyer_letter'. Deliberately NOT a typed date — captures whatever the lawyer wrote on the letter. POST-V1: structured date once lifecycle state machine ships. R-5(c)."
    },
    "service_status": {
      "type": "string",
      "maxLength": 2000,
      "description": "Free-text service / delivery status for purpose='lawyer_letter'. R-5(c)."
    },
    "client_authorization_summary": {
      "type": "string",
      "maxLength": 4000,
      "description": "Free-text client authorization summary for purpose='lawyer_letter'. R-5(c)."
    },
    "preliminary_evidence_summary": {
      "type": "string",
      "maxLength": 4000,
      "description": "Free-text preliminary evidence summary for purpose='lawyer_letter'. R-5(c)."
    },
    "review_date": {
      "type": "string",
      "maxLength": 2000,
      "description": "Free-text review date descriptor for purpose='contract_review_*'. Deliberately NOT a typed date. POST-V1: structured date. R-5(c)."
    },
    "final_version_marker": {
      "type": "string",
      "maxLength": 2000,
      "description": "Free-text marker on the final-revision document for purpose='contract_review_final'. R-5(c)."
    }
  },
  "allOf": [
    {
      "if": {
        "required": ["purpose"],
        "properties": { "purpose": { "const": "work_order" } }
      },
      "then": true,
      "else": {
        "not": { "required": ["work_order_status"] }
      }
    }
  ],
  "$defs": {
    "ulid": {
      "type": "string",
      "pattern": "^[0-9a-z]{26}$"
    }
  }
}
