{
  "id": "01jrcasebox0000000000000d1",
  "tenant_id": "tenant-local-v1",
  "actor_user_id": "local-user",
  "matter_id": "01jrcasebox0000000000000m1",
  "source": "uploaded",
  "custody_chain": [
    { "actor_user_id": "local-user", "action": "register", "at": "2026-05-20T09:05:00.000Z" }
  ],
  "filename": "complaint.pdf",
  "content_hash": "sha256:e3b0c44298fc1c149afbf4c8996fb92427ae41e4649b934ca495991b7852b855",
  "storage_uri": "file:///Users/lawyer/Library/Application Support/lawbar/docs/01jrcasebox0000000000000d1.pdf",
  "ocr_job_id": null,
  "language": "zh-Hans",
  "page_count": 12,
  "doc_type": "pleading",
  "received_at": "2026-05-20T09:04:30.000Z",
  "status": "registered"
}
