{
  "id": "01jrcasebox0000000000000df",
  "tenant_id": "tenant-local-v1",
  "actor_user_id": "local-user",
  "matter_id": "01jrcasebox0000000000000m3",
  "source": "uploaded",
  "filename": "counsel-engagement-2026.pdf",
  "content_hash": "sha256:5f5f5f5f5f5f5f5f5f5f5f5f5f5f5f5f5f5f5f5f5f5f5f5f5f5f5f5f5f5f5f5f",
  "storage_uri": "file:///Users/lawyer/Library/Application Support/lawbar/docs/df.pdf",
  "doc_type": "contract",
  "received_at": "2026-01-20T11:00:00.000Z",
  "status": "registered",
  "purpose": "counsel_contract"
}
