{
  "id": "01jrcasebox0000000000000dl",
  "tenant_id": "tenant-local-v1",
  "actor_user_id": "local-user",
  "matter_id": "01jrcasebox0000000000000m1",
  "source": "uploaded",
  "filename": "wechat-screenshot-2026-05-12-1320.png",
  "content_hash": "sha256:bfbfbfbfbfbfbfbfbfbfbfbfbfbfbfbfbfbfbfbfbfbfbfbfbfbfbfbfbfbfbfbf",
  "storage_uri": "file:///Users/lawyer/Library/Application Support/lawbar/docs/dl.png",
  "doc_type": "exhibit",
  "received_at": "2026-05-12T13:20:30.000Z",
  "status": "registered",
  "purpose": "screenshot"
}
